#CODE;ENGLISH;FRENCH;GERMAN;;SPANISH;;;;;;;;;x
TLK_871_NAME;The Last Kingdom;The Last Kingdom;The Last Kingdom;;The Last Kingdom;The Last Kingdom;The Last Kingdom;The Last Kingdom;The Last Kingdom;The Last Kingdom;The Last Kingdom;The Last Kingdom;x
TLK_871_DESC;871 AD. Only Wessex stands against the Danes.;871 AD. Only Wessex stands against the Danes.;871 AD. Only Wessex stands against the Danes.;;871 DC. Solo Wessex resiste.;871 AD. Only Wessex stands against the Danes.;871 AD. Only Wessex stands against the Danes.;871 AD. Only Wessex stands against the Danes.;871 AD. Only Wessex stands against the Danes.;871 AD. Only Wessex stands against the Danes.;871 AD. Only Wessex stands against the Danes.;871 AD. Only Wessex stands against the Danes.;x
TLK_UHTRED_ARRIVAL_TITLE;A Saxon Born of Danes;A Saxon Born of Danes;A Saxon Born of Danes;;A Saxon Born of Danes;A Saxon Born of Danes;A Saxon Born of Danes;A Saxon Born of Danes;A Saxon Born of Danes;A Saxon Born of Danes;A Saxon Born of Danes;A Saxon Born of Danes;x
TLK_UHTRED_ARRIVAL_DESC;A young warrior stands at the gates of Winchester. He is Uhtred of Bebbanburg - Saxon by birth, Dane by upbringing. Beside him stands Brida. Father Beocca vouches for them both. Can a man who worships pagan gods be trusted to fight for Wessex?;A young warrior stands at the gates of Winchester. He is Uhtred of Bebbanburg - Saxon by birth, Dane by upbringing. Beside him stands Brida. Father Beocca vouches for them both. Can a man who worships pagan gods be trusted to fight for Wessex?;A young warrior stands at the gates of Winchester. He is Uhtred of Bebbanburg - Saxon by birth, Dane by upbringing. Beside him stands Brida. Father Beocca vouches for them both. Can a man who worships pagan gods be trusted to fight for Wessex?;;A young warrior stands at the gates of Winchester. He is Uhtred of Bebbanburg - Saxon by birth, Dane by upbringing. Beside him stands Brida. Father Beocca vouches for them both. Can a man who worships pagan gods be trusted to fight for Wessex?;A young warrior stands at the gates of Winchester. He is Uhtred of Bebbanburg - Saxon by birth, Dane by upbringing. Beside him stands Brida. Father Beocca vouches for them both. Can a man who worships pagan gods be trusted to fight for Wessex?;A young warrior stands at the gates of Winchester. He is Uhtred of Bebbanburg - Saxon by birth, Dane by upbringing. Beside him stands Brida. Father Beocca vouches for them both. Can a man who worships pagan gods be trusted to fight for Wessex?;A young warrior stands at the gates of Winchester. He is Uhtred of Bebbanburg - Saxon by birth, Dane by upbringing. Beside him stands Brida. Father Beocca vouches for them both. Can a man who worships pagan gods be trusted to fight for Wessex?;A young warrior stands at the gates of Winchester. He is Uhtred of Bebbanburg - Saxon by birth, Dane by upbringing. Beside him stands Brida. Father Beocca vouches for them both. Can a man who worships pagan gods be trusted to fight for Wessex?;A young warrior stands at the gates of Winchester. He is Uhtred of Bebbanburg - Saxon by birth, Dane by upbringing. Beside him stands Brida. Father Beocca vouches for them both. Can a man who worships pagan gods be trusted to fight for Wessex?;A young warrior stands at the gates of Winchester. He is Uhtred of Bebbanburg - Saxon by birth, Dane by upbringing. Beside him stands Brida. Father Beocca vouches for them both. Can a man who worships pagan gods be trusted to fight for Wessex?;A young warrior stands at the gates of Winchester. He is Uhtred of Bebbanburg - Saxon by birth, Dane by upbringing. Beside him stands Brida. Father Beocca vouches for them both. Can a man who worships pagan gods be trusted to fight for Wessex?;x
TLK_UHTRED_ARRIVAL_OPT_A;Welcome him. Wessex needs warriors.;Welcome him. Wessex needs warriors.;Welcome him. Wessex needs warriors.;;Welcome him. Wessex needs warriors.;Welcome him. Wessex needs warriors.;Welcome him. Wessex needs warriors.;Welcome him. Wessex needs warriors.;Welcome him. Wessex needs warriors.;Welcome him. Wessex needs warriors.;Welcome him. Wessex needs warriors.;Welcome him. Wessex needs warriors.;x
TLK_UHTRED_ARRIVAL_OPT_B;Send him away. A pagan cannot be trusted.;Send him away. A pagan cannot be trusted.;Send him away. A pagan cannot be trusted.;;Send him away. A pagan cannot be trusted.;Send him away. A pagan cannot be trusted.;Send him away. A pagan cannot be trusted.;Send him away. A pagan cannot be trusted.;Send him away. A pagan cannot be trusted.;Send him away. A pagan cannot be trusted.;Send him away. A pagan cannot be trusted.;Send him away. A pagan cannot be trusted.;x